{
  "ir_version": "1",
  "page": 88,
  "printed_page": null,
  "page_class": "narrative",
  "page_size": {"width": 1190.55, "height": 841.89, "unit": "pt"},
  "source": {
    "engine": "TEXT_LAYER",
    "tool": "pdfplumber 0.11.9",
    "document_sha256": "d67772421ddeceac697de71c5a84945ae7c34779bae44d6456738844d4950521",
    "file_name": "MBB_2025_537873.pdf"
  },
  "blocks": [
    {
      "id": "p88-b1",
      "type": "paragraph",
      "text": "Bên cạnh đó, MB chú trọng quản lý rủi ro môi trường xã hội theo quy định:",
      "bbox": [219.21, 125.92, 498.62, 134.42]
    },
    {
      "id": "p88-b2",
      "type": "paragraph",
      "text": "Được đánh giá rủi ro môi trường – xã hội Dư nợ được quản lý rủi ro môi trường –",
      "bbox": [219.21, 144.85, 551.41, 153.35]
    },
    {"id": "p88-b3", "type": "paragraph", "text": "100 %\nDự án", "bbox": [219.21, 162.64, 314.88, 203.55]},
    {
      "id": "p88-b4",
      "type": "paragraph",
      "text": "Định hướng kinh doanh năm 2026 của MB tiếp tục bám sát các chủ trương của Chính phủ\nvà NHNN về thúc đẩy tăng trưởng kinh tế xanh và phát triển bền vững. Theo đó, Ngân\nhàng tập trung triển khai các giải pháp nhằm thúc đẩy dòng vốn tín dụng hướng tới các\nhoạt động sản xuất, kinh doanh thân thiện với môi trường và hỗ trợ quá trình chuyển đổi\nxanh của nền kinh tế.",
      "bbox": [218.1, 247.81, 555.45, 296.3]
    },
    {
      "id": "p88-b5",
      "type": "paragraph",
      "text": "MB ưu tiên cấp tín dụng đối với các khách hàng và phương án kinh doanh đáp ứng tiêu\nchí xanh, đặc biệt là các dự án đổi mới công nghệ, nâng cao hiệu quả sử dụng năng lượng\nvà giảm phát thải. Đồng thời, tích cực triển khai các chương trình hỗ trợ lãi suất theo định\nhướng của Chính phủ và NHNN, trong đó có chương trình hỗ trợ lãi suất 2%/năm đối với\ncác dự án xanh, kinh tế tuần hoàn và các dự án đáp ứng tiêu chuẩn ESG.",
      "bbox": [218.1, 307.8, 555.48, 356.28]
    },
    {
      "id": "p88-b6",
      "type": "paragraph",
      "text": "MB khuyến khích và ưu tiên các khách hàng ứng dụng công nghệ hiện đại, tiết kiệm năng\nlượng và giảm phát thải, qua đó nâng cao năng lực cạnh tranh và đáp ứng yêu cầu ngày\ncàng khắt khe của thị trường xuất khẩu.",
      "bbox": [218.1, 367.78, 555.4, 396.28]
    },
    {
      "id": "p88-b7",
      "type": "paragraph",
      "text": "MB tiếp tục nghiên cứu và phát triển các chương trình tín dụng và sản phẩm tài chính đặc\nthù cho các lĩnh vực gắn với phát triển bền vững như: năng lượng tái tạo, nông nghiệp\nxanh, giao thông xanh và bất động sản xanh, góp phần thúc đẩy quá trình chuyển đổi sang\nmô hình tăng trưởng xanh của nền kinh tế.",
      "bbox": [218.1, 407.78, 555.44, 446.26]
    },
    {
      "id": "p88-b8",
      "type": "paragraph",
      "text": "MB tập trung thực hiện các chương trình, dự án liên quan đến ESG, trong đó trọng tâm là\nxây dựng các chương trình sản phẩm theo Khung tín dụng xanh của MB và xây dựng nâng\ncấp mô hình quản trị rủi ro tích hợp yếu tố ESG tiệm cận thông lệ quốc tế. Theo Khung\nTín dụng xanh của MB, MB định hướng cho vay xanh các Khách hàng hoạt động trong\ncác lĩnh vực chính: Năng lượng tái tạo - năng lượng hiệu quả, Giao thông sạch, Bất động\nsản xanh, Nông nghiệp xanh, các lĩnh vực giảm phát thải khí nhà kính. Cùng với 7 lĩnh vực\nthuộc Danh mục xanh ban hành tại Quyết định số 21/2025/QĐ-TTg, MB có cơ hội mở rộng\nnhóm Khách hàng trong lĩnh vực xanh phù hợp với quy định luật pháp Việt Nam. Theo\nđó, MB có các chính sách, sản phẩm dành cho khách hàng thuộc Danh mục xanh gồm:",
      "bbox": [218.1, 472.49, 555.48, 560.96]
    },
    {
      "id": "p88-b9",
      "type": "paragraph",
      "text": "Áp dụng lãi suất cho vay thấp hơn 0,5 – 1,5%/năm so với mức lãi suất bình quân đối với\ncác dự án ESG triển khai mới đáp ứng các điều kiện cấp tín dụng xanh của NHNN và\nMB. Ưu tiên room tín dụng trong giai đoạn hạn chế room, áp dụng các hình thức đầu tư,\ncho vay như vay hạn mức kinh doanh, bổ sung vốn lưu động, phát hành bảo lãnh, thư tín\ndụng… theo từng phân khúc.",
      "bbox": [218.27, 581.28, 555.64, 629.76]
    },
    {
      "id": "p88-b10",
      "type": "paragraph",
      "text": "Ngân hàng triển khai gói tín dụng xanh nhằm thúc đẩy quá trình chuyển đổi xanh trong\nlĩnh vực giao thông, tập trung vào Chương trình cho vay mua ô tô điện VinFast với các ưu",
      "bbox": [218.27, 672.38, 555.57, 690.88]
    },
    {
      "id": "p88-b11",
      "type": "paragraph",
      "text": "• Tăng thời gian cho vay từ 84 tháng lên 96 tháng\n• Thời gian ân hạn gốc tối đa 6 tháng\n• Cho vay tối đa 90% nhu cầu vốn và tối đa 85% giá trị tài sản đảm bảo",
      "bbox": [218.27, 702.37, 493.54, 730.86]
    },
    {
      "id": "p88-b12",
      "type": "paragraph",
      "text": "Chính sách trên góp phần thúc đẩy tiêu dùng xanh, mở rộng khả năng tiếp cận các sản\nphẩm tín dụng ưu đãi cho khách hàng, đồng thời khuyến khích chuyển dịch sang phương\ntiện giao thông thân thiện môi trường, phù hợp định hướng phát triển bền vững và tiêu",
      "bbox": [218.27, 742.36, 555.64, 770.85]
    },
    {"id": "p88-b13", "type": "furniture", "text": "BÁO CÁO THƯỜNG NIÊN • 2025", "bbox": [448.19, 34.45, 555.59, 41.45]},
    {"id": "p88-b14", "type": "paragraph", "text": "xã hội", "bbox": [396.83, 153.86, 420.52, 162.36]},
    {"id": "p88-b15", "type": "paragraph", "text": "126.361 tỷ đồng", "bbox": [397.49, 169.88, 561.72, 210.35]},
    {"id": "p88-b16", "type": "paragraph", "text": "chiếm 12,1% tổng dư nợ toàn hàng", "bbox": [396.83, 209.54, 528.04, 218.04]},
    {"id": "p88-b17", "type": "furniture", "text": "BÁO CÁO THƯỜNG NIÊN • 2025", "bbox": [634.96, 34.45, 742.36, 41.45]},
    {"id": "p88-b18", "type": "paragraph", "text": "Phân khúc Khách hàng", "bbox": [634.95, 123.26, 723.97, 131.76]},
    {
      "id": "p88-b19",
      "type": "paragraph",
      "text": "Thông qua Gói sản phẩm tài trợ trung dài hạn dành cho KHDN, MB tài trợ các dự án xanh",
      "bbox": [813.54, 123.33, 1150.81, 131.83]
    },
    {"id": "p88-b20", "type": "paragraph", "text": "doanh nghiệp (KHDN)", "bbox": [634.95, 133.26, 719.31, 141.76]},
    {
      "id": "p88-b21",
      "type": "paragraph",
      "text": "tại các lĩnh vực: Sản xuất xe điện, Taxi xanh, Năng lượng tái tạo (điện gió, điện mặt trời,...).\nMB cũng đã tích cực tài trợ quá trình chuyển đổi giao thông xanh với Chương trình tài trợ\nđại lý phân phối Vinfast.",
      "bbox": [813.54, 133.33, 1150.92, 161.82]
    },
    {
      "id": "p88-b22",
      "type": "paragraph",
      "text": "Các sản phẩm của MB khi ban hành đã lồng ghép các định hướng hướng tới khách hàng\ncó chiến lược chuyển đổi xanh như: khách hàng áp dụng các chứng nhận về quy trình\nISO, Nhãn năng lượng… với Gói sản phẩm tài trợ vốn lưu động dành cho các doanh\nnghiệp sản xuất, cung cấp, lắp đặt thiết bị điện; kế hoạch áp dụng các chứng nhận ISO,\nGlobalGAP, VietGAP, GMP, Organic, JSC … gồm các chương trình, sản phẩm cụ thể như\nChương trình tài trợ ngành gạo vùng Tây Nam Bộ.",
      "bbox": [813.54, 173.32, 1150.92, 231.8]
    },
    {
      "id": "p88-b23",
      "type": "paragraph",
      "text": "Tận dụng lợi thế công nghệ trên 3 nền tảng App MBBank, BIZ MBBank, BaaS MB, MB tích\ncực truyền thông về các dịch vụ được cung cấp bởi các công ty trong hệ sinh thái MB và\ncác đối tác thông qua các nền tảng số do MB sở hữu. MB cũng hợp tác chặt chẽ với các\nđối tác chiến lược để mở rộng kênh phân phối các sản phẩm, dịch vụ ngân hàng trên kênh\nviễn thông và hoạt động đại lý ngân hàng với các sản phẩm mang hàm lượng công nghệ\ncao thông qua thiết bị thông minh tới nhóm khách hàng hiện hữu và khách hàng tiềm\nnăng của MB.",
      "bbox": [813.54, 243.3, 1150.91, 311.78]
    },
    {"id": "p88-b24", "type": "heading", "text": "CHƯƠNG 5 • BÁO CÁO PHÁT TRIỂN BỀN VỮNG • 171", "bbox": [977.59, 34.45, 1150.87, 41.45]},
    {"id": "p88-b25", "type": "paragraph", "text": "170 • CHƯƠNG 5 • BÁO CÁO PHÁT TRIỂN BỀN VỮNG", "bbox": [39.69, 34.45, 215.06, 41.45]},
    {"id": "p88-b26", "type": "paragraph", "text": "Kế hoạch năm 2026", "bbox": [39.51, 248.89, 149.52, 260.89]},
    {"id": "p88-b27", "type": "paragraph", "text": "Hoạt động hỗ trợ khách\nhàng tiếp cận sản phẩm\ntín dụng xanh", "bbox": [39.51, 473.62, 173.78, 514.42]},
    {"id": "p88-b28", "type": "paragraph", "text": "Về Chính sách", "bbox": [39.69, 581.45, 118.17, 593.45]},
    {"id": "p88-b29", "type": "paragraph", "text": "Về Sản phẩm", "bbox": [39.69, 649.48, 112.85, 661.48]},
    {"id": "p88-b30", "type": "paragraph", "text": "Phân khúc KHCN", "bbox": [39.68, 672.29, 106.03, 680.79]},
    {"id": "p88-b31", "type": "paragraph", "text": "đãi như sau:", "bbox": [218.27, 692.37, 264.67, 700.87]},
    {"id": "p88-b32", "type": "paragraph", "text": "chí ESG của ngân hàng.", "bbox": [218.27, 772.35, 308.73, 780.85]}
  ]
}
