{
  "ir_version": "1",
  "page": 78,
  "printed_page": null,
  "page_class": "narrative",
  "page_size": {"width": 1190.55, "height": 841.89, "unit": "pt"},
  "source": {
    "engine": "TEXT_LAYER",
    "tool": "pdfplumber 0.11.9",
    "document_sha256": "ca43995e793f717d647b8ccb1244ea9d801ac4c094101758d4f4becc3f1f1e89",
    "file_name": "TCB_2025_539917.pdf"
  },
  "blocks": [
    {"id": "p78-b1", "type": "paragraph", "text": "Bà Nguyễn Thu Lan", "bbox": [214.02, 356.27, 300.93, 366.27]},
    {
      "id": "p78-b2",
      "type": "paragraph",
      "text": "Tham gia HĐQT Techcombank từ: 04/2024 Tham gia HĐQT Techcombank từ: 04/2019",
      "bbox": [214.02, 424.44, 544.3, 433.76]
    },
    {
      "id": "p78-b3",
      "type": "paragraph",
      "text": "Bà Nguyễn Thu Lan là Phó Chủ tịch HĐQT Ông Saurabh Narayan Agarwal là thành\nTechcombank từ tháng 4/2024. Bà Nguyễn viên HĐQT Techcombank từ tháng 4/2019\nThu Lan có hơn 22 năm kinh nghiệm làm đến nay. Trước khi gia nhập Techcombank,\nviệc tại Techcombank và từng đảm nhiệm ông từng đảm nhiệm vị trí quản lý tại các\nnhiều vị trí quan trọng tại Techcombank và tổ chức tài chính lớn như: Chuyên gia phân\nCông ty con của Techcombank.",
      "bbox": [214.02, 459.06, 544.27, 520.04]
    },
    {
      "id": "p78-b4",
      "type": "paragraph",
      "text": "Bà tốt nghiệp Cử nhân Kinh tế - Trường Đại Kỳ và Singapore.\nhọc Kinh tế quốc dân và Cử nhân Nga văn -\nTrường Đại học Sư phạm Ngoại Ngữ Hà Nội. Bằng cấp",
      "bbox": [214.02, 543.59, 446.83, 575.64]
    },
    {"id": "p78-b5", "type": "paragraph", "text": "Ông Saurabh Narayan Agarwal\nThành viên HĐQT", "bbox": [385.51, 356.27, 519.84, 377.53]},
    {"id": "p78-b6", "type": "paragraph", "text": "Sinh năm: 1981", "bbox": [385.51, 414.51, 440.38, 423.27]},
    {"id": "p78-b7", "type": "paragraph", "text": "Kinh nghiệm", "bbox": [385.51, 446.15, 432.69, 454.65]},
    {
      "id": "p78-b8",
      "type": "paragraph",
      "text": "tích cao cấp, Giám đốc Công ty McKinsey,\nNew Delhi, Ấn Độ và New Jersey, Hoa Kỳ và\nGiám đốc Warburg Pincus New York, Hoa",
      "bbox": [385.51, 512.1, 544.27, 541.6]
    },
    {
      "id": "p78-b9",
      "type": "paragraph",
      "text": "Ông tốt nghiệp Cử nhân ngành Công nghệ,\nKỹ thuật Điện và Thạc sĩ ngành Công nghệ,\nVi Điện tử Học viện Công nghệ Ấn Độ\nBombay, Thạc sĩ ngành Quản trị Kinh doanh\n(MBA) trường Quản trị Kinh doanh Harvard.",
      "bbox": [385.51, 578.22, 544.27, 628.71]
    },
    {"id": "p78-b10", "type": "paragraph", "text": "Ông Phạm Nghiêm Xuân Bắc", "bbox": [646.3, 356.27, 775.11, 366.27]},
    {"id": "p78-b11", "type": "paragraph", "text": "Ông Eugene Keith Galbraith", "bbox": [817.79, 356.27, 938.28, 366.27]},
    {"id": "p78-b12", "type": "paragraph", "text": "Thành viên HĐQT độc lập", "bbox": [646.3, 370.53, 724.85, 377.53]},
    {"id": "p78-b13", "type": "paragraph", "text": "Thành viên HĐQT độc lập", "bbox": [817.79, 370.53, 896.34, 377.53]},
    {"id": "p78-b14", "type": "paragraph", "text": "Sinh năm: 1961", "bbox": [646.3, 414.51, 701.25, 423.27]},
    {
      "id": "p78-b15",
      "type": "paragraph",
      "text": "Sinh năm: 1952\nTham gia HĐQT Techcombank từ: 04/2024 Tham gia HĐQT Techcombank từ: 04/2024 Được bổ nhiệm Người phụ trách Quản trị",
      "bbox": [646.3, 414.51, 1148.03, 433.76]
    },
    {"id": "p78-b16", "type": "paragraph", "text": "Kinh nghiệm", "bbox": [817.79, 446.11, 864.97, 454.61]},
    {
      "id": "p78-b17",
      "type": "paragraph",
      "text": "Kinh nghiệm\nÔng Phạm Nghiêm Xuân Bắc là Thành viên Ông Eugene Keith Galbraith là Thành viên Kinh nghiệm\nHĐQT độc lập từ tháng 4/2024. Ông đã HĐQT độc lập từ tháng 4/2024. Ông đã có Ông Nguyễn Tuấn Minh gia nhập\ntừng đảm nhiệm nhiều vị trí lãnh đạo tại các nhiều năm kinh nghiệm làm Cố vấn hoạch Techcombank từ tháng 5/2013 và đã đảm\ntổ chức trong nước và quốc tế và có nhiều định kinh tế tỉnh và Cố vấn kinh tế cho Bộ nhiệm nhiều vị trí quản lý khác nhau tại\nnăm kinh nghiệm trong các lĩnh vực đầu tư Tài chính Indonesia. Đảm nhiệm nhiều vị Techcombank, bao gồm: Giám đốc Pháp\nnước ngoài, tư vấn quản trị doanh nghiệp, tái trí lãnh đạo quan trọng tại công ty chứng chế, Giám đốc Khối Tuân thủ, Kiểm soát\ncơ cấu doanh nghiệp, phân tích và xây dựng khoán, tổ chức quốc tế, ngân hàng tại Rủi ro Hoạt động và Pháp chế, Giám đốc\nchiến lược kinh doanh của doanh nghiệp, Indonesia như: Tổng Giám đốc tại Công ty Cố vấn Pháp lý thuộc Khối Quản trị Ngân\nngân hàng và tài chính, chứng khoán/thị Chứng khoán ABN-Amro Asia Indonesia; hàng. Trước đó, ông đã có hơn 20 năm làm\ntrường vốn, bất động sản, và sở hữu trí tuệ. Thành viên HĐQT tại Công ty Chứng khoán chuyên gia tư vấn luật, luật sư hành nghề,\nÔng đảm nhiệm các vị trí quản lý tại Công ABN-Amro Asia; Nhà sáng lập kiêm Tổng luật sư nội bộ và làm quản lý cấp cao tại\nty Cổ phần Chứng khoán Thành phố Hồ Chí Giám đốc tại Asiawise.com; Phó Chủ tịch các công ty tư vấn của Việt Nam, các chi\nMinh (HSC), Công ty TNHH Tầm Nhìn và HĐQT tại Ngân hàng OCBC NISP; Phó nhánh hãng luật quốc tế ở Việt Nam, ngân\nLiên danh, Công ty Luật TNHH Tầm nhìn và Tổng Giám đốc, Chủ tịch Hội đồng ủy viên hàng thương mại và công ty chứng khoán ở\nLiên danh, Công ty Cổ phần Cộng Hưởng … tại Ngân hàng Central Asia (BCA); Cố vấn Việt Nam. Ông Nguyễn Tuấn Minh được bổ\nvà có hơn 30 năm hành nghề luật sư.",
      "bbox": [646.3, 446.12, 1148.06, 625.58]
    },
    {
      "id": "p78-b18",
      "type": "paragraph",
      "text": "cao cấp tại Công ty Bank Pictet & Cie (Asia) nhiệm và đảm nhận vị trí người Phụ trách\nLtd; Cố vấn cao cấp tại Công ty McKinsey Quản trị Ngân hàng và Chánh Văn phòng\n& Company; Cố vấn tại Công ty PT Sarana HĐQT từ tháng 11/2019.",
      "bbox": [817.79, 617.08, 1148.05, 646.57]
    },
    {"id": "p78-b19", "type": "paragraph", "text": "Bằng cấp", "bbox": [646.3, 638.21, 681.71, 646.71]},
    {"id": "p78-b20", "type": "paragraph", "text": "Menara Nusantara.", "bbox": [817.79, 648.57, 887.45, 657.07]},
    {
      "id": "p78-b21",
      "type": "paragraph",
      "text": "Ông tốt nghiệp Thạc sỹ quản trị kinh doanh\n- Henley Management College, Vương\nquốc Anh; Cử nhân Luật - Đại học Quốc gia Bằng cấp\nHà Nội; Chương trình sau đại học, Viện Luật Ông là Tiến sỹ về Nhân chủng học - Trường Học viện Ngoại giao và Cử nhân Luật - Đại\nSở hữu trí tuệ Mátxcơva, Nga; Kỹ sư - Viện Đại học Johns Hopkins; tốt nghiệp Thạc học Luật Hà Nội.\nCơ khí Ô tô Mátxcơva, Nga.",
      "bbox": [646.3, 651.68, 1148.04, 712.67]
    },
    {
      "id": "p78-b22",
      "type": "paragraph",
      "text": "sỹ về Nhân chủng học - Trường Đại học\nPennsylvania; và cử nhân Triết học - Trường Hiện ông đang là Luật sư và là Thành viên\nĐại học Johns Hopkins.",
      "bbox": [817.79, 704.17, 1148.06, 733.66]
    },
    {"id": "p78-b23", "type": "paragraph", "text": "Nền tảng vững vàng của Tech 155", "bbox": [1036.23, 25.6, 1148.03, 32.7]},
    {
      "id": "p78-b24",
      "type": "paragraph",
      "text": "Ông Nguyễn Tuấn Minh\nNgười phụ trách Quản trị Ngân hàng, Thư ký Công ty\nvà Chánh Văn phòng HĐQT",
      "bbox": [989.29, 356.27, 1148.06, 386.53]
    },
    {"id": "p78-b25", "type": "paragraph", "text": "Sinh năm: 1967", "bbox": [989.29, 414.51, 1045.74, 423.27]},
    {"id": "p78-b26", "type": "paragraph", "text": "Ngân hàng từ: 11/2019", "bbox": [989.29, 435.51, 1070.59, 444.26]},
    {"id": "p78-b27", "type": "paragraph", "text": "Bằng cấp\nÔng tốt nghiệp Cử nhân Quan hệ quốc tế -", "bbox": [989.29, 659.21, 1148.03, 681.18]},
    {"id": "p78-b28", "type": "paragraph", "text": "Đoàn Luật sư Hà Nội.", "bbox": [989.29, 725.17, 1067.26, 733.67]},
    {"id": "p78-b29", "type": "paragraph", "text": "154 Báo cáo thường niên 2025", "bbox": [42.52, 25.6, 147.45, 32.7]},
    {"id": "p78-b30", "type": "paragraph", "text": "GIỚI THIỆU VỀ THÀNH VIÊN\nHỘI ĐỒNG QUẢN TRỊ", "bbox": [42.52, 105.52, 191.68, 131.53]},
    {"id": "p78-b31", "type": "paragraph", "text": "Phó Chủ tịch HĐQT", "bbox": [214.02, 370.53, 273.04, 377.53]},
    {"id": "p78-b32", "type": "paragraph", "text": "Sinh năm: 1969", "bbox": [214.02, 413.94, 271.11, 422.69]},
    {"id": "p78-b33", "type": "paragraph", "text": "Kinh nghiệm", "bbox": [214.02, 445.58, 261.19, 454.08]},
    {"id": "p78-b34", "type": "paragraph", "text": "Bằng cấp", "bbox": [214.02, 532.68, 249.43, 541.18]}
  ]
}
