{
  "ir_version": "1",
  "page": 71,
  "printed_page": "CMC",
  "page_class": "auditor_report",
  "page_size": {"width": 595.276, "height": 841.89, "unit": "pt"},
  "source": {
    "engine": "TEXT_LAYER",
    "tool": "pdfplumber 0.11.9",
    "document_sha256": "8946a531f3ddc9ad7ffae44495663536461d75a1cbfa215909e459b78fbc8df0",
    "file_name": "CMG_2024_511722.pdf"
  },
  "blocks": [
    {"id": "p71-b1", "type": "paragraph", "text": "Số tham chiếu: 11887657/677705166 - HN", "bbox": [367.26, 37.5, 556.43, 46.5]},
    {"id": "p71-b2", "type": "heading", "text": "BÁO CÁO KIỂM TOÁN ĐỘC LẬP", "bbox": [193.77, 58.86, 404.86, 72.86]},
    {
      "id": "p71-b3",
      "type": "paragraph",
      "text": "Chúng tôi đã kiểm toán báo cáo tài chính hợp nhất kèm theo của Công ty Cổ phần Tập đoàn Công nghệ CMC (“Công\nty”) và các công ty con (sau đây được gọi chung là “Tập đoàn”), được lập ngày 27 tháng 6 năm 2025 và được trình bày\ntừ trang 6 đến trang 60, bao gồm bảng cân đối kế toán hợp nhất tại ngày 31 tháng 3 năm 2025, báo cáo kết quả hoạt\nđộng kinh doanh hợp nhất và báo cáo lưu chuyển tiền tệ hợp nhất cho năm tài chính kết thúc cùng ngày và các thuyết\nminh báo cáo tài chính hợp nhất kèm theo.",
      "bbox": [42.88, 100.51, 555.66, 161.49]
    },
    {
      "id": "p71-b4",
      "type": "paragraph",
      "text": "Trách nhiệm của Ban Điều hành\nBan Điều hành chịu trách nhiệm về việc lập và trình bày trung thực và hợp lý báo cáo tài chính hợp nhất của Tập đoàn\ntheo các Chuẩn mực kế toán Việt Nam, Chế độ kế toán doanh nghiệp Việt Nam và các quy định pháp lý có liên quan\nđến việc lập và trình bày báo cáo tài chính hợp nhất và chịu trách nhiệm về kiểm soát nội bộ mà Ban Điều hành xác\nđịnh là cần thiết để đảm bảo cho việc lập và trình bày báo cáo tài chính hợp nhất không có sai sót trọng yếu do gian",
      "bbox": [42.88, 178.48, 555.65, 239.47]
    },
    {
      "id": "p71-b5",
      "type": "paragraph",
      "text": "Trách nhiệm của Kiểm toán viên\nTrách nhiệm của chúng tôi là đưa ra ý kiến về báo cáo tài chính hợp nhất dựa trên kết quả của cuộc kiểm toán. Chúng\ntôi đã tiến hành kiểm toán theo các Chuẩn mực kiểm toán Việt Nam. Các chuẩn mực này yêu cầu chúng tôi tuân thủ\nchuẩn mực và các quy định về đạo đức nghề nghiệp, lập kế hoạch và thực hiện cuộc kiểm toán để đạt được sự đảm\nbảo hợp lý về việc liệu báo cáo tài chính hợp nhất của Tập đoàn có còn sai sót trọng yếu hay không.",
      "bbox": [42.88, 269.46, 555.64, 330.45]
    },
    {
      "id": "p71-b6",
      "type": "paragraph",
      "text": "Công việc kiểm toán bao gồm thực hiện các thủ tục nhằm thu thập các bằng chứng kiểm toán về các số liệu và thuyết\nminh trên báo cáo tài chính hợp nhất. Các thủ tục kiểm toán được lựa chọn dựa trên xét đoán của kiểm toán viên, bao\ngồm đánh giá rủi ro có sai sót trọng yếu trong báo cáo tài chính hợp nhất do gian lận hoặc nhầm lẫn. Khi thực hiện\nđánh giá các rủi ro này, kiểm toán viên đã xem xét kiểm soát nội bộ của Tập đoàn liên quan đến việc lập và trình bày\nbáo cáo tài chính hợp nhất trung thực, hợp lý nhằm thiết kế các thủ tục kiểm toán phù hợp với tình hình thực tế, tuy\nnhiên không nhằm mục đích đưa ra ý kiến về hiệu quả của kiểm soát nội bộ của Tập đoàn. Công việc kiểm toán cũng\nbao gồm đánh giá tính thích hợp của các chính sách kế toán được áp dụng và tính hợp lý của các ước tính kế toán của\nBan Điều hành cũng như đánh giá việc trình bày tổng thể báo cáo tài chính hợp nhất.",
      "bbox": [42.88, 347.45, 555.65, 447.42]
    },
    {
      "id": "p71-b7",
      "type": "paragraph",
      "text": "Chúng tôi tin tưởng rằng các bằng chứng kiểm toán mà chúng tôi đã thu thập được là đầy đủ và thích hợp để làm cơ\nsở cho ý kiến kiểm toán của chúng tôi.",
      "bbox": [42.88, 464.42, 555.64, 486.42]
    },
    {
      "id": "p71-b8",
      "type": "paragraph",
      "text": "Ý kiến của Kiểm toán viên\nTheo ý kiến của chúng tôi, báo cáo tài chính hợp nhất đã phản ánh trung thực và hợp lý, trên các khía cạnh trọng yếu,\ntình hình tài chính hợp nhất của Tập đoàn tại ngày 31 tháng 3 năm 2025, cũng như kết quả hoạt động kinh doanh hợp\nnhất và tình hình lưu chuyển tiền tệ hợp nhất cho năm tài chính kết thúc cùng ngày, phù hợp với các Chuẩn mực kế\ntoán Việt Nam, Chế độ kế toán doanh nghiệp Việt Nam và các quy định pháp lý có liên quan đến việc lập và trình bày\nbáo cáo tài chính hợp nhất.",
      "bbox": [42.88, 503.42, 555.81, 577.4]
    },
    {"id": "p71-b9", "type": "paragraph", "text": "Công ty Trách nhiệm Hữu hạn Ernst & Young Việt Nam", "bbox": [44.22, 616.39, 283.3, 625.39]},
    {"id": "p71-b10", "type": "paragraph", "text": "Số Giấy CNĐKHN kiểm toán:", "bbox": [44.22, 668.39, 168.22, 677.39]},
    {"id": "p71-b11", "type": "paragraph", "text": "Ngày 27 tháng 6 năm 2025", "bbox": [44.22, 733.38, 162.77, 742.38]},
    {"id": "p71-b12", "type": "paragraph", "text": "Kính gửi: Các cổ đông của Công ty Cổ phần Tập đoàn Công nghệ CMC", "bbox": [145.8, 76.5, 452.36, 85.5]},
    {
      "id": "p71-b13",
      "type": "paragraph",
      "text": "Đào Văn Thích\nKiểm toán viên\nSố Giấy CNĐKHN kiểm toán:\n3732-2021-004-1",
      "bbox": [384.46, 637.37, 508.47, 685.36]
    },
    {"id": "p71-b14", "type": "paragraph", "text": "lận hoặc nhầm lẫn.", "bbox": [42.88, 243.46, 126.74, 252.46]},
    {"id": "p71-b15", "type": "paragraph", "text": "Lê Đức Trường\nPhó Tổng Giám đốc", "bbox": [44.22, 642.4, 130.49, 664.39]},
    {"id": "p71-b16", "type": "paragraph", "text": "0816-2023-004-1", "bbox": [44.22, 681.38, 123.16, 690.38]},
    {"id": "p71-b17", "type": "paragraph", "text": "Hà Nội, Việt Nam", "bbox": [44.22, 720.38, 118.87, 729.38]},
    {"id": "p71-b18", "type": "furniture", "text": "CMC CORPORATION", "bbox": [42.05, 811.23, 115.21, 819.23]},
    {"id": "p71-b19", "type": "furniture", "text": "73", "bbox": [550.97, 811.23, 560.03, 819.23]}
  ]
}
